{
  "schema": "specnav.verification.generation-review.v1",
  "id": "generation-review-minimal",
  "change_id": "change-minimal",
  "reviewer_id": "reviewer-minimal",
  "snapshot_id": "snapshot-minimal",
  "snapshot_hash": "aaaaaaaaaaaaaaaaaaaaaaaaaaaaaaaaaaaaaaaaaaaaaaaaaaaaaaaaaaaaaaaa",
  "parent_generation_id": null,
  "fingerprints": {
    "case_snapshot_hash": "aaaaaaaaaaaaaaaaaaaaaaaaaaaaaaaaaaaaaaaaaaaaaaaaaaaaaaaaaaaaaaaa",
    "code_sha": "1111111111111111111111111111111111111111",
    "test_sha": "2222222222222222222222222222222222222222222222222222222222222222",
    "environment_hash": "3333333333333333333333333333333333333333333333333333333333333333",
    "runtime_version": "2.0.0",
    "kernel_version": "2.0.0"
  },
  "historical_break_loop_failure_ids": [
    "failure-history"
  ],
  "baseline": {
    "runs": {
      "count": 0,
      "digest": "4f53cda18c2baa0c0354bb5f9a3ecbe5ed12ab4d8e11ba873c2f11161202b945",
      "records": []
    },
    "attempts": {
      "count": 0,
      "digest": "4f53cda18c2baa0c0354bb5f9a3ecbe5ed12ab4d8e11ba873c2f11161202b945",
      "records": []
    },
    "executions": {
      "count": 0,
      "digest": "4f53cda18c2baa0c0354bb5f9a3ecbe5ed12ab4d8e11ba873c2f11161202b945",
      "records": []
    },
    "readings": {
      "count": 0,
      "digest": "4f53cda18c2baa0c0354bb5f9a3ecbe5ed12ab4d8e11ba873c2f11161202b945",
      "records": []
    },
    "failures": {
      "count": 0,
      "digest": "4f53cda18c2baa0c0354bb5f9a3ecbe5ed12ab4d8e11ba873c2f11161202b945",
      "records": []
    },
    "repair_links": {
      "count": 0,
      "digest": "4f53cda18c2baa0c0354bb5f9a3ecbe5ed12ab4d8e11ba873c2f11161202b945",
      "records": []
    },
    "evidence": {
      "count": 0,
      "digest": "4f53cda18c2baa0c0354bb5f9a3ecbe5ed12ab4d8e11ba873c2f11161202b945",
      "records": []
    },
    "transition_proposals": {
      "count": 0,
      "digest": "4f53cda18c2baa0c0354bb5f9a3ecbe5ed12ab4d8e11ba873c2f11161202b945",
      "records": []
    },
    "transition_receipts": {
      "count": 0,
      "digest": "4f53cda18c2baa0c0354bb5f9a3ecbe5ed12ab4d8e11ba873c2f11161202b945",
      "records": []
    },
    "attempt_facts": {
      "count": 0,
      "digest": "4f53cda18c2baa0c0354bb5f9a3ecbe5ed12ab4d8e11ba873c2f11161202b945",
      "records": []
    }
  },
  "prepared_at": "2026-08-25T12:00:00.000Z",
  "review_sha256": "bbbbbbbbbbbbbbbbbbbbbbbbbbbbbbbbbbbbbbbbbbbbbbbbbbbbbbbbbbbbbbbb"
}
